{
  "$schema": "https://json-schema.org/draft/2020-12/schema",
  "$id": "https://ticket-decision-core.local/schemas/ruleset.schema.json",
  "title": "Ticket decision ruleset",
  "type": "object",
  "additionalProperties": false,
  "required": ["schema_version", "id", "version", "rules"],
  "properties": {
    "schema_version": {"const": 1},
    "id": {"type": "string", "minLength": 1},
    "version": {"type": "string", "minLength": 1},
    "collectors": {
      "type": "array",
      "items": {"$ref": "#/$defs/collector"}
    },
    "rules": {
      "type": "array",
      "minItems": 1,
      "items": {"$ref": "#/$defs/rule"}
    }
  },
  "$defs": {
    "collector": {
      "type": "object",
      "additionalProperties": false,
      "required": ["id", "kind", "provides", "instruction"],
      "properties": {
        "id": {"type": "string", "minLength": 1},
        "kind": {"enum": ["log", "api", "database"]},
        "provides": {
          "type": "array",
          "minItems": 1,
          "items": {"type": "string", "minLength": 1},
          "uniqueItems": true
        },
        "instruction": {"type": "string", "minLength": 1},
        "parameters": {
          "type": "object",
          "additionalProperties": {"type": "string", "minLength": 1}
        }
      }
    },
    "rule": {
      "type": "object",
      "additionalProperties": false,
      "required": ["id", "priority", "when", "then"],
      "properties": {
        "id": {"type": "string", "minLength": 1},
        "priority": {"type": "integer"},
        "when": {"$ref": "#/$defs/condition"},
        "then": {"$ref": "#/$defs/result"}
      }
    },
    "condition": {
      "oneOf": [
        {
          "type": "object",
          "additionalProperties": false,
          "required": ["all"],
          "properties": {
            "all": {"type": "array", "minItems": 1, "items": {"$ref": "#/$defs/condition"}}
          }
        },
        {
          "type": "object",
          "additionalProperties": false,
          "required": ["any"],
          "properties": {
            "any": {"type": "array", "minItems": 1, "items": {"$ref": "#/$defs/condition"}}
          }
        },
        {
          "type": "object",
          "additionalProperties": false,
          "required": ["not"],
          "properties": {"not": {"$ref": "#/$defs/condition"}}
        },
        {
          "type": "object",
          "additionalProperties": false,
          "required": ["fact", "operator", "value"],
          "properties": {
            "fact": {"type": "string", "minLength": 1},
            "operator": {
              "enum": ["eq", "neq", "in", "not_in", "gt", "gte", "lt", "lte", "contains", "exists"]
            },
            "value": {"not": {"type": "null"}}
          }
        }
      ]
    },
    "result": {
      "type": "object",
      "additionalProperties": false,
      "required": ["outcome", "reason_code"],
      "properties": {
        "outcome": {"enum": ["actionable", "policy_denied", "already_satisfied", "manual_review"]},
        "reason_code": {"type": "string", "minLength": 1},
        "directive": true
      }
    }
  }
}
